排名,工具名稱,每月訪問量,增長,增長率,標籤
1,SUNO V4,52.3M,1.1M,2.1%,"AI Music Generator, Text to Music, AI Singing Generator"
2,CapCut,38.8M,-1.1M,-2.8%,"AI Video Editing, Text to Speech"
3,Doubao PixelDance,31.3M,10.2M,48.3%,"AI Chatbot, Writing Assistants, AI Voice Assistants"
4,TurboScribe,8.9M,724K,8.9%,"Transcription, AI Speech Recognition, AI Speech Synthesis"
5,Clipchamp,8.5M,-267.3K,-3.0%,"AI Video Editing, Text to Speech, AI Video Enhancing"
6,Vidnoz,6M,-477.2K,-7.3%,"AI Video Generator, Text to Speech, AI Avatar Generator"
7,Artlist,5.9M,-294K,-4.8%,"AI Music Generator, AI Video Editing"
8,Adobe Podcast,5.1M,-141.4K,-2.7%,"Audio Enhancer, AI Podcast Assistant"
9,Udio,4.8M,122.2K,2.6%,"AI Music Generator, Text to Music"
10,Voicemod,4.4M,293.4K,7.1%,AI Voice Changer
11,NaturalReader,4.3M,94.9K,2.2%,"Text to Speech, AI Voice Assistants"
12,Kapwing,4.3M,188K,4.6%,"Photo & Image Editor, AI Video Editing, Voice & Audio Editing"
13,Speechify,3.9M,-353.2K,-8.3%,"Text to Speech, AI Voice Assistants"
14,Thundr.tv,3.7M,1.2M,47.4%,"AI Voice Assistants, AI Voice Chat Generator"
15,Uhmegle,3.6M,924.9K,35.0%,"AI Voice Chat Generator, AI Chatbot, AI Character"
16,HitPaw Voice Changer,3.3M,513K,18.4%,"AI Voice Changer, AI Music Generator"
17,Moises App,2.7M,-44.4K,-1.6%,"Multi-purpose Tools, AI Music Generator, Audio Enhancer"
18,Vozard,2.7M,-43.2K,-1.6%,"AI Voice Changer, Voice & Audio Editing, AI Speech Synthesis"
19,PDF Editor,2.5M,-157.7K,-5.8%,"AI PDF, Text to Speech, AI Files Assistant"
20,TTSMaker,2.2M,-642K,-22.7%,"Text to Speech, AI Voice Assistants"
21,LALAL.AI,1.9M,-91.7K,-4.7%,AI Music Generator
22,Krisp,1.8M,216.2K,13.3%,"AI Noise Cancellation, AI Recording &Summarizer"
23,LANDR: Creative Tools for Musicians,1.8M,94.8K,5.5%,"AI Music Generator, AI Recording &Summarizer"
24,Jammable,1.7M,323.9K,22.8%,"AI Music Generator, Text to Speech"
25,elsaspeak,1.7M,-23K,-1.4%,"AI Speech Recognition, AI Voice Assistants"
26,Voicemaker®,1.4M,415.8K,43.9%,"Text to Speech, AI Voice Assistants"
27,TopMediai®,1.3M,-8.4K,-0.6%,"AI Video Editing, AI Music Generator"
28,TopMediai,1.3M,-8.4K,-0.6%,"AI Music Generator, AI Voice Cloning"
29,Fadr - AI Music Maker,1.3M,315.5K,33.6%,AI Music Generator
30,Mureka,1.2M,757.6K,155.7%,"AI Lyrics Generator, AI Music Generator"
31,Brev.ai,1.2M,257.2K,27.3%,"AI Music Generator, Text to Music, AI Lyrics Generator"
32,eMastered,1.1M,91K,8.9%,"AI Music Generator, Audio Enhancer"
33,FakeYou - Deep Fake Text to Speech,1.1M,115K,11.7%,"Text to Speech, AI Voice Cloning"
34,SpeechGen.io,1M,-214.8K,-17.6%,"Text to Speech, AI Voice Assistants"
35,Vapi,904.4K,190.1K,26.6%,"AI Voice Assistants, AI Developer Tools"
36,FineShare FineVoice,876.4K,-204.9K,-18.9%,AI Singing Generator
37,SOUNDRAW - AI Music Generator,824.4K,-116.4K,-12.4%,"AI Music Generator, Text to Music"
38,MusicHero.ai,812.8K,23.4K,3.0%,"AI Music Generator, Text to Music"
39,Kits AI,812.8K,-161.3K,-16.6%,"AI Music Generator, AI Voice Cloning"
40,Resemble AI Voice Generator with Text-to-Speech and Speech-to-Speech,784.1K,76.1K,10.8%,AI Voice Cloning
41,Suno AI Music Free Online,738.7K,-353.6K,-32.4%,"AI Music Generator, Text to Music"
42,Podcastle,729.3K,-17.3K,-2.3%,"AI Video Editing, AI Voice Assistants"
43,Typecast,667.7K,10.1K,1.5%,"Text to Speech, AI Video Generator"
44,Musicfy,652.3K,-76.2K,-10.5%,"AI Music Generator, Text to Music"
45,LOVO AI Voice Generator,642.3K,-73.5K,-10.3%,Text to Speech
46,AssemblyAI,629.7K,13.9K,2.3%,"Transcription, AI Speech Recognition"
47,DupDub Voice Generator,618.6K,-24.5K,-3.8%,"Text to Speech, Voice & Audio Editing"
48,Voiceflow,608K,-100.4K,-14.2%,"AI Voice Assistants, AI Chatbot"
49,Vocal Image,604.1K,513.1K,563.8%,"Voice & Audio Editing, AI Voice Changer, AI Speech Synthesis"
50,Wavel AI,592.6K,-40.7K,-6.4%,"Text to Speech, AI Voice Cloning"
